{"action_readiness":{"actual_system_utc_required_for_execution":true,"caller_time_authority":false,"durable_create_exclusive_marker_required":true,"exact_transition_1_required":true,"global_monotonic_deadline_seconds":180,"leader_reaped_and_process_group_gone_required_before_evidence":true,"namespace_local_syscall_ids_only":true,"pid_namespace_mapping_required_before_marker":true,"procfs_failure":"FAIL_CLOSED","retry_allowed":false},"default_action":"REJECT_UNKNOWN_OR_SEMANTICALLY_INVALID","entries":[{"input_id":"S17-EXT-001","status":"IMPLEMENTED","verifier_id":"STAGE17-S17-EXT-001-SEMANTIC-VERIFIER","verifier_version":"14"},{"input_id":"S17-EXT-002","status":"IMPLEMENTED","verifier_id":"STAGE17-S17-EXT-002-SEMANTIC-VERIFIER","verifier_version":"1"},{"input_id":"S17-EXT-003","status":"IMPLEMENTED","verifier_id":"STAGE17-S17-EXT-003-SEMANTIC-VERIFIER","verifier_version":"1"},{"input_id":"S17-EXT-004","status":"IMPLEMENTED","verifier_id":"STAGE17-S17-EXT-004-SEMANTIC-VERIFIER","verifier_version":"1"},{"input_id":"S17-EXT-005","status":"IMPLEMENTED","verifier_id":"STAGE17-S17-EXT-005-SEMANTIC-VERIFIER","verifier_version":"1"},{"input_id":"S17-EXT-006","status":"IMPLEMENTED","verifier_id":"STAGE17-PILOT-CANDIDATE-EXTERNAL-VERIFIER","verifier_version":"1"},{"input_id":"S17-EXT-007","status":"IMPLEMENTED","verifier_id":"STAGE17-S17-EXT-007-SEMANTIC-VERIFIER","verifier_version":"1"},{"input_id":"S17-EXT-008","status":"IMPLEMENTED","verifier_id":"STAGE17-S17-EXT-008-SEMANTIC-VERIFIER","verifier_version":"1"},{"input_id":"S17-EXT-009","status":"IMPLEMENTED","verifier_id":"STAGE17-S17-EXT-009-SEMANTIC-VERIFIER","verifier_version":"1"},{"input_id":"S17-EXT-010","status":"IMPLEMENTED","verifier_id":"STAGE17-S17-EXT-010-SEMANTIC-VERIFIER","verifier_version":"1"}],"fixed_action_plan":{"path":"config/stage17/stage17-read-only-preflight-fixed-action-plan-v6.json","sha256":"41ef692166148c29b6d880b6c551fa8e51173c116ac40c950489a78dec8ef4fe","size_bytes":11546},"implementations":{"collector":{"path":"tools/stage17_read_only_preflight_collector_v2.py","sha256":"dbbb2720047fec0b5a757d58f51c38d6262b1b0a6a5d0fc62ccf057a1466aa6a","size_bytes":1889},"collector_v1_helper":{"path":"tools/stage17_read_only_preflight_collector_v1.py","sha256":"ff19f0cf370d558a1309d684049b59beced6c9c9520b983180920090c5baae48","size_bytes":11963},"executor":{"path":"tools/stage17_read_only_preflight_executor_v13.py","sha256":"61b0d93586c01122e6482d03caf91318006cb34add09bb4aeb360a000ed63926","size_bytes":58574},"openssh_snapshot_broker":{"path":"tools/stage17_openssh_parent_snapshot_v2.py","sha256":"61de48b7207afd5b85bc50ef20f35600ed9611a8a885f7f09525234079e1af1a","size_bytes":5312},"openssh_snapshot_broker_v1_helper":{"path":"tools/stage17_openssh_parent_snapshot_v1.py","sha256":"9dbeb2676eefbf41951548cd0c96b8c0c44ecbf3884f9d5472127d819123e767","size_bytes":17645},"operational_semantics":{"path":"tools/stage17_operational_semantics_v1.py","sha256":"0e0a5e2aabe3b4767200fc18ea93a3d2028bbd6d99547bfc8745b541649f19fb","size_bytes":35970},"pilot_candidate_verifier":{"path":"tools/stage17_pilot_candidate_artifact.py","sha256":"d25d7340891987bfb2c5db652f8f279ca30d7f5c65452d53e1dc05f0b11ff8a1","size_bytes":8311},"process_group_supervisor":{"path":"tools/stage17_process_group_supervisor_v2.py","sha256":"e32016e241822c5066519b66dff7553eaa57b2f487dbc605f8c7aff95f1cccc9","size_bytes":21022},"semantic_verifier":{"path":"tools/stage17_read_only_preflight_semantic_verifier_v15.py","sha256":"9e1cd6f321c2804b37c251827dc018837ac2f885a3d3255e67ecb26a284d6939","size_bytes":25311},"semantic_verifier_v10_helper":{"path":"tools/stage17_read_only_preflight_semantic_verifier_v10.py","sha256":"10913aa9076d054fecf40d983d7660e6393a26adde0b3bbfa662918ebaedfb53","size_bytes":22598},"semantic_verifier_v11_helper":{"path":"tools/stage17_read_only_preflight_semantic_verifier_v11.py","sha256":"2610ec2c1b932a51f3cb46f7d51168c4e24cb9e07645ceb13b86aa5c1f365b35","size_bytes":22898},"semantic_verifier_v12_helper":{"path":"tools/stage17_read_only_preflight_semantic_verifier_v12.py","sha256":"d6b3e26e541e205f39223ca83885daa12ce333860cc57fbea2f259f400c0211d","size_bytes":25752},"semantic_verifier_v13_helper":{"path":"tools/stage17_read_only_preflight_semantic_verifier_v13.py","sha256":"8221245b79150040004c8b45f75e16d1f955df790a2c4afadbd1ec7fe35356d0","size_bytes":29651},"semantic_verifier_v3_helper":{"path":"tools/stage17_semantic_verifier_v3.py","sha256":"cbc6c54f5949ef12545f58b82b216c6a38bd681453620b2d18820c6dfed39636","size_bytes":34177},"semantic_verifier_v4_helper":{"path":"tools/stage17_semantic_verifier_v4.py","sha256":"da24dfc0dd73698c586603818c6083d03df476cc498fe790c7a19ab8a273cc01","size_bytes":33018},"semantic_verifier_v5_helper":{"path":"tools/stage17_semantic_verifier_v5.py","sha256":"d2a11839849bba2de9254aaea17d1931ed1822d6ec8a16fe721c6689928e1e22","size_bytes":32406},"semantic_verifier_v6_helper":{"path":"tools/stage17_semantic_verifier_v6.py","sha256":"c50f34ff74033ada65d0e6819b7e349c2549e2d960f0710f159720b5a0e51f6c","size_bytes":30886},"semantic_verifier_v7_helper":{"path":"tools/stage17_semantic_verifier_v7.py","sha256":"ab063887899f3ee93b7b54dad4d4fc903bae2e642478a40d273af9f616c55853","size_bytes":32374},"semantic_verifier_v8_helper":{"path":"tools/stage17_semantic_verifier_v8.py","sha256":"8d20a62841269e543eeab2b49e7a4912342a9d52c8268317ef926d9c7318d94e","size_bytes":33679},"state_journal":{"path":"tools/stage17_state_journal_v17.py","sha256":"2edbcf18b6db33426e3f730d262be55d1e7db86c7a78546aeb0e83445e6f12b5","size_bytes":1368},"state_journal_v10_helper":{"path":"tools/stage17_state_journal_v10.py","sha256":"9389fc3ba8801a1b023b3c6fb6256ea178b59e12cd1b1736f7993e625afc7cbd","size_bytes":27214},"state_journal_v11_helper":{"path":"tools/stage17_state_journal_v11.py","sha256":"58fc8eabe844c255bfbefa0c8b65027d8d43b8e26bc0d8babec6e764ec35b83b","size_bytes":27203},"state_journal_v1_helper":{"path":"tools/stage17_state_journal.py","sha256":"d617e121ea11ca6b4b576b6e7c693117c8844ba85d2fa74dffb442b18bf9fd62","size_bytes":59304}},"operational_admission":{"all_ten_semantic_verifiers_implemented":true,"exact_artifact_bytes_rehashed":true,"phase18_chronology_separate":true,"signed_action_authority_verified_by_controller":true,"synthetic_requires_explicit_test_gate":true,"synthetic_resolves_operational_input":false},"operational_contract":{"path":"config/stage17/stage17-operational-input-external-contract-v1.json","sha256":"5f20e91b96a3634febabf9a1929f60af27dd28f457b17f7cb45df2d322dfc06c","size_bytes":585},"operational_definitions":{"external_contract":{"path":"config/stage17/stage17-operational-input-external-contract-v1.json","sha256":"5f20e91b96a3634febabf9a1929f60af27dd28f457b17f7cb45df2d322dfc06c","size_bytes":585},"fixed_phase_actions":{"path":"config/stage17/stage17-fixed-phase-actions-v1.json","sha256":"546ecdc559023210ed665b97fdb7287e20149e4435f0269e9d5579e71201895a","size_bytes":3537},"phase18_authorization_draft":{"path":"config/stage17/phase18-authorization-draft-v1.json","sha256":"fd0bf9a0a8eeb7f26e62b1e1da4c2232c80f347dffef71343da21be53d30083b","size_bytes":392},"phase18_readiness_template":{"path":"config/stage17/phase18-readiness-template-v1.json","sha256":"8adf89d1d717b953b042dbba5a42d408bcba796e561ef0d856d616e5b5cc1506","size_bytes":393}},"operational_implementations":{"exit_state_machine":{"path":"tools/stage17_exit_state_machine_v1.py","sha256":"3759bb269510a2ce42316c4888668e6dc0e5cd10b2b9f8cd20435623101e0dc3","size_bytes":13215},"phase_controller":{"path":"tools/stage17_phase_controller_v1.py","sha256":"c72babf2e7c7ed7e5ea1f8f1570b4f7e1e5f8e49f2a7fd3b8a6288ab37c6e26c","size_bytes":23633},"pid_namespace_supervisor":{"path":"tools/stage17_process_group_supervisor_v2.py","sha256":"e32016e241822c5066519b66dff7553eaa57b2f487dbc605f8c7aff95f1cccc9","size_bytes":21022},"semantic_admission":{"path":"tools/stage17_operational_semantics_v1.py","sha256":"0e0a5e2aabe3b4767200fc18ea93a3d2028bbd6d99547bfc8745b541649f19fb","size_bytes":35970}},"policy_id":"STAGE17-READ-ONLY-PREFLIGHT-EVIDENCE-ADMISSION-POLICY-v15","policy_version":"15","predecessor":{"adr_0126":{"path":"docs/decisions/0126-stage17-no-predecessor-attestation-executor-binding.md","sha256":"837c9b18b049fa579d988fe7eee75da7c6ec39d12f1600f64117da47859b7b8f","size_bytes":6226},"catalog_sha256":"044a6187d36a6e309b187e1a8b7071bb3b8b7e56d8b1ddb8daeaf3d0c5f495fa","genesis_file_sha256":"da9ba7f6072b2e4555db98db8d7c886c133c7f5e98c4f2964b5ef67ba438fafe","genesis_record_sha256":"42cc89ed8bc596602a23f977ec75f745119bdd861daa1cd2d8881043b0117e29","graph_sha256":"70d1a5c48b60fccdc21ed797733c3fa09829c58a2306b2ca960a769938e63802","policy_v14":{"path":"config/stage17/stage17-read-only-preflight-evidence-admission-policy-v14.json","sha256":"c7096e07a551c5cb16af959374c775028c9cbdb41333260849adbe5ad266c366","size_bytes":15475},"resolution_schema_sha256":"09f4fd122cc4a5441c6f2bdf785780a2f3649ae098bcbec703cfb89f1fd209f6"},"protocol_version":"2.0.0-pre.3","schema_bindings":[{"path":"config/schemas/stage17-read-only-preflight-evidence-admission-policy-v14.schema.json","sha256":"2e84c0ff421cbada9dbb2505f67f7a1ab3d800c0b1ea0b0f7eb4862df5f11d6d","size_bytes":4478},{"path":"config/schemas/stage17-operational-evidence-envelope-v14.schema.json","sha256":"911638831c8d81705096a8b77eb9a25978b7b650ba77d4fd3bf178df9388e384","size_bytes":1972},{"path":"config/schemas/stage17-read-only-preflight-authorization-v11.schema.json","sha256":"42055e3db3aa31ab24b3e841801b4a301569adb48fb98bef2c680b2ff80f3141","size_bytes":3567},{"path":"config/schemas/stage17-read-only-preflight-supporting-contract-v12.schema.json","sha256":"b9bb04744d4524ff399327309799aaa2f5f18210611313541db15152809ea1fc","size_bytes":5718},{"path":"config/schemas/stage17-preflight-pre-marker-blocker-v1.schema.json","sha256":"b309f560c35cb8375edfc0fd3f602bc9ea4ae38118f39dd0de07fb7d54f1c4f5","size_bytes":2129},{"path":"config/schemas/stage17-preflight-post-marker-blocker-v1.schema.json","sha256":"a21c5ae9